{
  "schema_version": 1,
  "id": "SBX-2026-0002",
  "title": "First-principles arithmetic projection and seeded null workbench",
  "status": "exploratory",
  "scope": "sandbox-only",
  "epistemic_status": {
    "claim_of_truth": false,
    "independently_reviewed": false,
    "eligible_for_automatic_promotion": false
  },
  "proposition": "Explore whether a dimensionless arithmetic projection has an association with a synthetic response under a seeded unrestricted permutation null.",
  "falsifier": "A permutation null distribution, mapping ablation, failed assumptions or counterexamples can contradict the exploratory association.",
  "provenance": {
    "input_kind": "synthetic",
    "sources": [
      "Hand-authored unverified arithmetic-like CSV fixture in this experiment; no observational datasets.",
      "Pinned, optional software snapshot: LcosmosS/S.T.A.R.-Labs at 51927a9b396cdfa880f3128440db4715acdec8dc."
    ],
    "upstream_commit": "51927a9b396cdfa880f3128440db4715acdec8dc"
  },
  "limitations": [
    "Synthetic integers are not certified LMFDB elliptic curve invariants.",
    "No cosmological or physical measurement; model comparison is exploratory only.",
    "Null exchangeability may not hold for galaxies or isogeny groups; external scientific tests require a justified alternative."
  ]
}
