{
  "schema_version": 1,
  "id": "SBX-2026-0006",
  "title": "Prospective enlarged arithmetic isogeny pilot v2",
  "status": "exploratory",
  "scope": "sandbox-only",
  "epistemic_status": {
    "claim_of_truth": false,
    "independently_reviewed": false,
    "eligible_for_automatic_promotion": false
  },
  "proposition": "Test a fixed ACSC-like versus modified MCJ arithmetic distance contrast over every eligible conductor from a SHA-pinned 64,687-row ecdata source using rank-conditioned shuffles.",
  "falsifier": "Conditional null produces equally or more extreme statistic, invariant identities fail, or effects are unstable under predeclared coordinate scaling.",
  "provenance": {
    "input_kind": "observed",
    "sources": [
      "JohnCremona/ecdata commit 25cec5ecfec8b9f016eb1631ac633194c2bed39f SHA256 259f3846329395b371e8079c77a6f1097adaebc98a054974573e241416efa968; legacy SBX-2026-0004 negative/p=0.344 exploratory outcome."
    ],
    "upstream_commit": "51927a9b396cdfa880f3128440db4715acdec8dc"
  },
  "limitations": [
    "All work remains sandbox-only, unreviewed and non-promotable.",
    "No physical correspondence or theorem validity is asserted.",
    "Original historical manuscripts remain unmodified; this experiment is a critical ledger, not a retrospective correction."
  ]
}
